<?xml version="1.0" encoding="utf-8"?>
<xs:schema xmlns:xsi="http://www.w3.org/2001/XMLSchema-instance" attributeFormDefault="unqualified" elementFormDefault="qualified" xmlns:xs="http://www.w3.org/2001/XMLSchema">
	<xs:element name="list">
		<xs:complexType>
			<xs:sequence>
				<xs:element maxOccurs="unbounded" name="item">
					<xs:complexType>
						<xs:sequence>
							<xs:element maxOccurs="unbounded" name="set">
								<xs:complexType>
									<xs:attribute name="name" type="xs:string" use="required" />
									<xs:attribute name="val" type="xs:string" use="required" />
								</xs:complexType>
							</xs:element>
							<xs:element minOccurs="0" name="for">
								<xs:complexType>
									<xs:sequence>
										<xs:choice maxOccurs="unbounded">
											<xs:element maxOccurs="unbounded" name="set">
												<xs:complexType>
													<xs:sequence minOccurs="0">
														<xs:element name="and">
															<xs:complexType>
																<xs:sequence>
																	<xs:element name="game">
																		<xs:complexType>
																			<xs:attribute name="chance" type="xs:unsignedByte" use="required" />
																			<xs:attribute name="skill" type="xs:boolean" use="optional" />
																		</xs:complexType>
																	</xs:element>
																</xs:sequence>
															</xs:complexType>
														</xs:element>
													</xs:sequence>
													<xs:attribute name="val" type="xs:unsignedShort" use="required" />
													<xs:attribute name="order" type="xs:string" use="required" />
													<xs:attribute name="stat" type="xs:string" use="required" />
												</xs:complexType>
											</xs:element>
											<xs:element name="add">
												<xs:complexType>
													<xs:sequence minOccurs="0">
														<xs:element name="and">
															<xs:complexType>
																<xs:sequence>
																	<xs:element minOccurs="0" name="player">
																		<xs:complexType>
																			<xs:attribute name="behind" type="xs:string" use="optional" />
																			<xs:attribute name="hp" type="xs:unsignedByte" use="optional" />
																		</xs:complexType>
																	</xs:element>
																	<xs:element minOccurs="0" name="using">
																		<xs:complexType>
																			<xs:attribute name="slotitem" type="xs:string" use="required" />
																		</xs:complexType>
																	</xs:element>
																</xs:sequence>
															</xs:complexType>
														</xs:element>
													</xs:sequence>
													<xs:attribute name="val" type="xs:short" use="required" />
													<xs:attribute name="order" type="xs:string" use="required" />
													<xs:attribute name="stat" type="xs:string" use="required" />
												</xs:complexType>
											</xs:element>
											<xs:element name="enchant">
												<xs:complexType>
													<xs:attribute name="val" type="xs:unsignedByte" use="required" />
													<xs:attribute name="order" type="xs:string" use="required" />
													<xs:attribute name="stat" type="xs:string" use="required" />
												</xs:complexType>
											</xs:element>
											<xs:element name="sub">
												<xs:complexType>
													<xs:sequence minOccurs="0">
														<xs:element name="and">
															<xs:complexType>
																<xs:sequence>
																	<xs:element name="game">
																		<xs:complexType>
																			<xs:attribute name="skill" type="xs:boolean" use="required" />
																			<xs:attribute name="chance" type="xs:unsignedByte" use="required" />
																		</xs:complexType>
																	</xs:element>
																</xs:sequence>
															</xs:complexType>
														</xs:element>
													</xs:sequence>
													<xs:attribute name="val" type="xs:unsignedByte" use="required" />
													<xs:attribute name="order" type="xs:string" use="required" />
													<xs:attribute name="stat" type="xs:string" use="required" />
												</xs:complexType>
											</xs:element>
											<xs:element name="mul">
												<xs:complexType>
													<xs:sequence minOccurs="0">
														<xs:element name="and">
															<xs:complexType>
																<xs:sequence>
																	<xs:element minOccurs="0" name="player">
																		<xs:complexType>
																			<xs:attribute name="hp" type="xs:unsignedByte" use="required" />
																		</xs:complexType>
																	</xs:element>
																	<xs:element minOccurs="0" name="using">
																		<xs:complexType>
																			<xs:attribute name="slotitem" type="xs:string" use="required" />
																		</xs:complexType>
																	</xs:element>
																</xs:sequence>
															</xs:complexType>
														</xs:element>
													</xs:sequence>
													<xs:attribute name="val" type="xs:decimal" use="required" />
													<xs:attribute name="order" type="xs:string" use="required" />
													<xs:attribute name="stat" type="xs:string" use="required" />
												</xs:complexType>
											</xs:element>
											<xs:element name="skill">
												<xs:complexType>
													<xs:attribute name="onCrit" type="xs:unsignedByte" use="optional" />
													<xs:attribute name="id" type="xs:unsignedShort" use="required" />
													<xs:attribute name="lvl" type="xs:unsignedByte" use="required" />
													<xs:attribute name="chance" type="xs:unsignedByte" use="optional" />
													<xs:attribute name="onCast" type="xs:unsignedByte" use="optional" />
												</xs:complexType>
											</xs:element>
										</xs:choice>
									</xs:sequence>
								</xs:complexType>
							</xs:element>
						</xs:sequence>
						<xs:attribute name="id" type="xs:unsignedShort" use="required" />
						<xs:attribute name="type" type="xs:string" use="required" />
						<xs:attribute name="name" type="xs:string" use="required" />
					</xs:complexType>
				</xs:element>
			</xs:sequence>
		</xs:complexType>
	</xs:element>
</xs:schema>